Read why @GovEdRendell thinks #TPP will be good for manufacturing and boost products #MadeInAmerica: ,483,169,2015-10-14 15:19:43,"Dad, husband, President, citizen."
Former Washington Governor Christine Gregoire on why the #TPP will help protect the environment: ,741,267,2015-10-13 21:49:18,"Dad, husband, President, citizen."
Expanding Medicaid isn't just practical—it's the right thing to do.  #PeopleOverPolitics,894,371,2015-10-13 20:18:49,"Dad, husband, President, citizen."
Repealing #Obamacare is still a bad idea. ,1521,628,2015-10-13 17:30:42,"Dad, husband, President, citizen."
Keep the conversation on gun violence going until Congress will #DoSomething about it: ,1387,741,2015-10-13 15:10:42,"Dad, husband, President, citizen."
"""Outdated trade rules put our workers at a disadvantage—and TPP will change that."" —President Obama  #TPP",1249,504,2015-10-10 18:30:49,"Dad, husband, President, citizen."
"In the weekly address, President Obama discusses how the #TPP will put American workers first. ",1005,361,2015-10-10 15:46:33,"Dad, husband, President, citizen."
Wind and solar energy are getting cheaper and cheaper—the #SwitchToClean energy is happening. ,2226,1377,2015-10-09 17:01:56,"Dad, husband, President, citizen."
Add your name to the list of people asking Congress to #DoSomething about gun violence: ,2085,1185,2015-10-08 22:22:07,"Dad, husband, President, citizen."
Check out how these @OFA volunteers are making a difference on gun violence in their community:  #DoSomething,998,381,2015-10-08 19:06:31,"Dad, husband, President, citizen."
Retweet if you agree: It's time for Congress to put politics aside and #DoSomething about gun violence. ,6972,10327,2015-10-08 16:16:39,"Dad, husband, President, citizen."
Our thoughts and prayers are not enough. It's time for Congress to #DoSomething to prevent gun violence tragedies: ,2170,1166,2015-10-08 14:22:22,"Dad, husband, President, citizen."
"""This will not change until the politics change."" —President Obama on gun violence #DoSomething ",2602,1415,2015-10-07 21:43:03,"Dad, husband, President, citizen."
Take a look at some of the most important recent stories on gun violence prevention:  #DoSomething,806,408,2015-10-07 20:28:34,"Dad, husband, President, citizen."
Add your name if you agree it's time for Congress to #DoSomething about gun violence in America. ,2527,1430,2015-10-07 18:54:30,"Dad, husband, President, citizen."
RT @WhiteHouse: Every hardworking American should earn enough money to support their family →  #StartTheConvo ,0,1319,2015-10-07 17:56:34,"Dad, husband, President, citizen."
LIVE: President Obama is speaking at the @WhiteHouse Summit on Worker Voice. ,664,226,2015-10-07 16:47:28,"Dad, husband, President, citizen."
An @OFA volunteer reflects on the trainings she received—that helped her land her dream job. ,569,200,2015-10-07 16:00:45,"Dad, husband, President, citizen."
"RT @WhiteHouse: President Obama's trade deal =
More #MadeInAmerica exports abroad.
More higher-paying jobs here at home. #TPP ",0,389,2015-10-06 20:23:36,"Dad, husband, President, citizen."
Stand up for American workers—add your name if you agree it's time to #LeadOnTrade. ,985,336,2015-10-06 18:42:52,"Dad, husband, President, citizen."
The #TPP establishes the highest labor standards of any trade agreement in history. ,1083,400,2015-10-06 17:25:53,"Dad, husband, President, citizen."
"The more U.S. goods sold abroad, the more higher-paying jobs are supported at home—another reason to #LeadOnTrade: ",1019,396,2015-10-06 15:47:20,"Dad, husband, President, citizen."
"""I refuse to leave our children a planet that's beyond their capacity to repair."" —President Obama #OurOcean2015 ",4157,2279,2015-10-05 21:41:32,"Dad, husband, President, citizen."
Add your name to support the most progressive trade deal in this nation's history:  #LeadOnTrade,827,301,2015-10-05 20:19:55,"Dad, husband, President, citizen."
"RT @WhiteHouse: ""Environmentalists praise wildlife measures in Trans-Pacific trade pact"" →  #TPP ",0,482,2015-10-05 17:43:18,"Dad, husband, President, citizen."
Great news: President Obama just secured a trade deal that puts American workers first.  #LeadOnTrade,1289,481,2015-10-05 15:54:13,"Dad, husband, President, citizen."
Twenty-three years and still going strong. Here's to many more. #HappyAnniversary ,94497,51895,2015-10-03 20:01:29,"Dad, husband, President, citizen."
"""Congress should do its job, stop kicking the can down the road, and pass a serious budget."" —President Obama ",2447,917,2015-10-03 18:29:58,"Dad, husband, President, citizen."
"In the weekly address, President Obama urges Congress to pass a real budget. ",1089,365,2015-10-03 16:59:47,"Dad, husband, President, citizen."
Private-sector jobs have grown for a record-breaking 67 straight months—but there's more to do.,1490,541,2015-10-02 20:14:56,"Dad, husband, President, citizen."
"More than 10,000 people die from gun violence in the U.S. each year—that can change.  ",2318,1932,2015-10-02 17:26:12,"Dad, husband, President, citizen."
Our thoughts and prayers are not enough—it's time to take action. ,13538,8354,2015-10-02 15:58:44,"Dad, husband, President, citizen."
"RT @WhiteHouse: Watch @POTUS speak on the tragic shooting in Roseburg, Oregon. #UCCShooting ",0,3554,2015-10-02 13:37:57,"Dad, husband, President, citizen."
"RT @WhiteHouse: At 6:20pm ET, @POTUS will deliver a statement on the shooting in Oregon →  #UCCShooting",0,618,2015-10-01 22:04:59,"Dad, husband, President, citizen."
"RT @WhiteHouse: RT if you agree: It's time to make community college free for responsible students → 
",0,1467,2015-10-01 17:40:33,"Dad, husband, President, citizen."
Organizers across the country are working to prevent gun violence—state by state. Read more: ,1909,745,2015-10-01 15:24:49,"Dad, husband, President, citizen."
LAST CALL: Enter for a chance to meet President Obama.  ,1481,422,2015-10-01 00:47:29,"Dad, husband, President, citizen."
DEADLINE: Tonight. Time to make your move—chip in now.  ,1718,519,2015-09-30 23:26:15,"Dad, husband, President, citizen."
This is your chance to meet President Obama. (No joke.)  ,1460,431,2015-09-30 22:26:20,"Dad, husband, President, citizen."
You and a guest could fly to D.C. and meet the President. Enter now for your chance: ,916,277,2015-09-30 21:19:13,"Dad, husband, President, citizen."
Give this grassroots movement a lift—become a recurring donor today:  ,1876,576,2015-09-30 19:45:41,"Dad, husband, President, citizen."
Enter before midnight and you—and your BFF—could meet the President this fall.  ,1060,307,2015-09-30 18:40:58,"Dad, husband, President, citizen."
Better hurry—the deadline to show your support for this grassroots movement is tonight.  ,2377,695,2015-09-30 17:21:54,"Dad, husband, President, citizen."
Want to hear that laugh in person? Throw your name in before tonight's deadline:  ,1314,385,2015-09-30 16:18:21,"Dad, husband, President, citizen."
Enter now and you could meet President Obama in D.C. this fall: ,836,258,2015-09-30 15:07:57,"Dad, husband, President, citizen."
"Coffee: √
Fall sweater: √
Meeting the President: ?

Enter before #NationalCoffeeDay ends:  ",2059,646,2015-09-29 22:00:15,"Dad, husband, President, citizen."
"Chip in to fight for real, lasting change:  ",4264,1440,2015-09-29 18:37:26,"Dad, husband, President, citizen."
Give it your best shot—enter today for your chance to meet the President:  ,2350,617,2015-09-29 17:33:17,"Dad, husband, President, citizen."
"In an interview with @RollingStone, President Obama lays out why we need to #ActOnClimate before it's too late. ",1895,816,2015-09-29 15:13:12,"Dad, husband, President, citizen."
This movement started with grassroots supporters just like you. Help keep it going—chip in $5 or more today: ,802,278,2015-09-28 21:03:26,"Dad, husband, President, citizen."
Watch a #VICEonHBO clip about President Obama's historic visit to a federal prison: ,1054,394,2015-09-28 19:13:17,"Dad, husband, President, citizen."
Don't miss the chance to meet President Obama this fall—all you have to do is enter: ,1110,321,2015-09-28 16:47:45,"Dad, husband, President, citizen."
RT @WhiteHouse: Watch @POTUS speak at the @UN General Assembly at 10am ET →  #UNGA ,0,509,2015-09-28 14:18:09,"Dad, husband, President, citizen."
Want to be the one walking through that door? Enter the contest now:  ,1625,484,2015-09-27 16:45:31,"Dad, husband, President, citizen."
Beat the buzzer—the big fundraising deadline is almost here.  ,2637,934,2015-09-26 18:46:06,"Dad, husband, President, citizen."
Time's running out—don't miss your chance to meet President Obama.  ,2545,976,2015-09-26 15:09:08,"Dad, husband, President, citizen."
Do you hear that? It's the sound of a big fundraising deadline. Chip in now:  ,1683,554,2015-09-25 22:15:11,"Dad, husband, President, citizen."
Fall is here—and so is your chance to meet President Obama. Enter now:  ,1243,378,2015-09-25 20:17:32,"Dad, husband, President, citizen."
Walk the walk—support the team that's fighting for today's important issues.  ,2039,663,2015-09-25 17:33:36,"Dad, husband, President, citizen."
Climate change is an issue that cannot be left for future generations—and @pontifex agrees:  #ActOnClimate,1662,892,2015-09-25 15:39:12,"Dad, husband, President, citizen."
You could win a chance to meet President Obama. (Let that sink in.) Enter now:  ,1586,507,2015-09-24 22:02:58,"Dad, husband, President, citizen."
Don't cruise past this fundraising deadline. Chip in now:  ,1570,443,2015-09-24 20:42:27,"Dad, husband, President, citizen."
"With less than a week left to avert a shutdown, Congress is wasting time trying to take away women's access to health care. #EnoughAlready",3505,2165,2015-09-24 19:30:29,"Dad, husband, President, citizen."
Change starts with people working together. Read how volunteers in Tucson are organizing to make change a reality: ,977,353,2015-09-24 16:45:07,"Dad, husband, President, citizen."
Give your #SquadGoals an upgrade—enter now to meet President Obama:  ,1050,389,2015-09-24 15:19:28,"Dad, husband, President, citizen."
17.6 million Americans covered—that's a number to celebrate:  #Obamacare,1471,636,2015-09-23 22:08:42,"Dad, husband, President, citizen."
Watch @Pontifex say why it's so important for everyone to come together to #ActOnClimate. #PopeInDC ,2927,1962,2015-09-23 19:56:24,"Dad, husband, President, citizen."
Dress to impress—you could win the chance to meet President Obama. Enter now:  ,1749,620,2015-09-23 17:46:51,"Dad, husband, President, citizen."
"""Michelle and I extend our wishes for an easy fast to all those observing Yom Kippur."" —President Obama",2387,770,2015-09-23 16:41:10,"Dad, husband, President, citizen."
"RT @WhiteHouse: “As the son of an immigrant, I’m happy to be a guest in this country, which was largely built by such families.” —@Pontifex…",0,2767,2015-09-23 15:24:53,"Dad, husband, President, citizen."
LIVE: Watch as @Pontifex is welcomed to the White House.  #PopeInDC,1160,504,2015-09-23 13:21:15,"Dad, husband, President, citizen."
Get your camera ready—this is your chance to meet President Obama. Enter now:  ,1598,486,2015-09-22 21:25:37,"Dad, husband, President, citizen."
LIVE: President Obama and others are greeting @Pontifex at Joint Base Andrews. ,1006,477,2015-09-22 20:03:04,"Dad, husband, President, citizen."
"RT @WhiteHouse: .@Pontifex is coming to the White House.
Here's what you need to know →  #PopeInDC ",0,1280,2015-09-22 17:08:51,"Dad, husband, President, citizen."
America doesn't need another shutdown—members of Congress need to do their job and pass a budget. Read more: ,1507,744,2015-09-22 16:05:08,"Dad, husband, President, citizen."
Hope you're ready—fall is here. ,5372,1727,2015-09-21 22:48:19,"Dad, husband, President, citizen."
Read how @OFA volunteers in Tucson are working hard to bring change to their community. ,739,249,2015-09-21 20:50:39,"Dad, husband, President, citizen."
Climate change is real—and it's time to act.  (h/t @washingtonpost) ,1710,1374,2015-09-21 17:49:40,"Dad, husband, President, citizen."
"RT @WhiteHouse: ""If we keep moving forward...my daughters’ children will be able to cross that bridge in an America that’s more free"" ",0,710,2015-09-21 16:37:03,"Dad, husband, President, citizen."
"""There’s nothing principled about the idea of another government shutdown."" —President Obama ",2434,948,2015-09-19 18:12:46,"Dad, husband, President, citizen."
"In the weekly address, President Obama calls on Congress to stop playing games with our economy and pass a budget. ",1781,684,2015-09-19 17:03:19,"Dad, husband, President, citizen."
LIVE: President Obama is speaking at the White House screening of @Vice's documentary on criminal justice reform. ,1004,436,2015-09-18 21:37:23,"Dad, husband, President, citizen."
"When women are empowered, extraordinary things happen. Read more:  ",3182,1706,2015-09-18 20:49:17,"Dad, husband, President, citizen."
Retweet if you agree. #LeadOnLeave ,2004,2104,2015-09-18 19:06:54,"Dad, husband, President, citizen."
It's time to #LeadOnLeave—because what's good for workers and families is good for the economy: ,1290,529,2015-09-18 17:19:52,"Dad, husband, President, citizen."
The uninsured rate continues to fall—and that's no accident. Read about how #Obamacare is making a difference: ,983,386,2015-09-18 16:00:51,"Dad, husband, President, citizen."
"""If you're eligible, commit to becoming a citizen today."" —President Obama #ConstitutionDay ",2297,927,2015-09-17 20:47:44,"Dad, husband, President, citizen."
Investments in clean energy are boosting the economy—while fighting climate change. #ActOnClimate ,1430,773,2015-09-17 18:44:13,"Dad, husband, President, citizen."
States and cities from the U.S. and China are pledging to #ActOnClimate—years earlier than national targets. ,1144,529,2015-09-17 17:15:43,"Dad, husband, President, citizen."
"Since President Obama took office, the economy has seen the longest streak of private-sector job growth on record. ",3353,1636,2015-09-17 15:05:10,"Dad, husband, President, citizen."
Obamacare is working—and it's lowering the uninsured rate: ,1875,630,2015-09-16 22:17:38,"Dad, husband, President, citizen."
"RT @POTUS: Cool clock, Ahmed. Want to bring it to the White House? We should inspire more kids like you to like science. It's what makes Am…",0,336975,2015-09-16 20:09:52,"Dad, husband, President, citizen."
"Since President Obama took office, the deficit has been reduced by more than two-thirds. ",3062,1680,2015-09-16 17:12:07,"Dad, husband, President, citizen."
LIVE: President Obama is speaking with a group of business leaders at the @BizRoundtable. ,715,248,2015-09-16 15:23:58,"Dad, husband, President, citizen."
Listen to President Obama's advice on going to college for high school seniors—including his oldest daughter. ,2969,1543,2015-09-15 20:59:22,"Dad, husband, President, citizen."
"RT @WhiteHouse: We've come a long way since the financial crisis.
Take a look back at the progress we've made:  ",0,572,2015-09-15 18:53:41,"Dad, husband, President, citizen."
Be part of the team fighting back against misinformation with facts:  ,1322,642,2015-09-15 15:50:05,"Dad, husband, President, citizen."
RT @WhiteHouse: “We’re giving you some news you can use!” —@POTUS on the #CollegeScorecard:  ,0,318,2015-09-14 23:53:23,"Dad, husband, President, citizen."
LIVE: President Obama is hosting a town hall on college access and affordability with high school students. ,843,374,2015-09-14 21:06:37,"Dad, husband, President, citizen."
Tune in at 4:40 p.m. ET to watch President Obama discuss college affordability with high school students in Iowa: ,691,284,2015-09-14 20:11:27,"Dad, husband, President, citizen."
"""From my family to yours, Shanah Tovah."" —President Obama on #RoshHashanah ",2125,936,2015-09-14 19:21:10,"Dad, husband, President, citizen."
"""Everyone should be able to find clear, reliable, open data on college affordability and value."" —President Obama ",2650,1055,2015-09-12 18:11:45,"Dad, husband, President, citizen."
"In the weekly address, President Obama discusses another step in expanding #CollegeOpportunity. ",1317,493,2015-09-12 16:53:46,"Dad, husband, President, citizen."
"RT @WhiteHouse: Watch @POTUS reflect on September 11, 2001. #911Anniversary #AskPOTUS #NeverForget ",0,765,2015-09-11 20:12:49,"Dad, husband, President, citizen."
"""The events of September 11, 2001, left a permanent mark on the spirit of every American."" —President Obama ",9512,5857,2015-09-11 16:26:20,"Dad, husband, President, citizen."
"""This vote is a victory for diplomacy ... and for the safety and security of the world."" —President Obama on the #IranDeal vote",1825,925,2015-09-10 22:09:42,"Dad, husband, President, citizen."
Retweet if you agree that education should be available to all those willing to work for it. #CollegeOpportunity ,3352,4115,2015-09-10 19:30:07,"Dad, husband, President, citizen."
"""I want two years of college to be as free and universal as high school is today."" —President Obama ",5665,3417,2015-09-10 17:12:00,"Dad, husband, President, citizen."
Progress happens when people fight for it. Join the movement—say you're in:  ,1534,596,2015-09-10 15:59:24,"Dad, husband, President, citizen."
"""I believe that working Americans should have the basic security of paid leave."" —President Obama #LeadOnLeave ",2675,1150,2015-09-09 21:06:45,"Dad, husband, President, citizen."
LIVE: President Obama and @DrBiden discuss the administration's plan to expand #CollegeOpportunity. ,730,338,2015-09-09 19:50:08,"Dad, husband, President, citizen."
Tune in at 3:40 p.m. ET to watch President Obama and @DrBiden speak in Michigan on expanding #CollegeOpportunity. ,707,314,2015-09-09 18:49:21,"Dad, husband, President, citizen."
"RT @WhiteHouse: Join the movement to make community college free for anyone willing to work for it: 
",0,1041,2015-09-09 18:34:27,"Dad, husband, President, citizen."
Solar energy is heading toward a record-setting year for growth. Find out more: ,1317,696,2015-09-09 17:29:11,"Dad, husband, President, citizen."
Get the facts on one of today's most consequential foreign policy debates:  #IranDeal,819,308,2015-09-09 16:09:59,"Dad, husband, President, citizen."
The Obama administration is pushing for paid leave and a higher minimum wage at the state and local level. ,1365,530,2015-09-08 21:17:49,"Dad, husband, President, citizen."
RT @WhiteHouse: Watch why VP Cheney is just as wrong on the #IranDeal as he was on Iraq →  #WrongThenWrongNow ,0,1198,2015-09-08 19:15:44,"Dad, husband, President, citizen."
Check out Secretary of State @JohnKerry's op-ed debunking some of the myths surrounding the #IranDeal. ,878,436,2015-09-08 17:37:52,"Dad, husband, President, citizen."
The #IranDeal has overwhelming support among leading scientists and non-proliferation experts. ,1777,947,2015-09-08 16:30:21,"Dad, husband, President, citizen."
"Today, America celebrates the grit and resilience of working families. Happy #LaborDay. ",3903,1531,2015-09-07 17:50:50,"Dad, husband, President, citizen."
"Today President Obama is expanding access to paid sick leave for about 300,000 federal workers.  #LeadOnLeave",2345,900,2015-09-07 16:22:58,"Dad, husband, President, citizen."
LIVE: President Obama is speaking at the Greater Boston Labor Council #LaborDay Breakfast. ,968,352,2015-09-07 15:21:04,"Dad, husband, President, citizen."
"RT @WhiteHouse: Big news: @POTUS is expanding access to paid sick leave for 300,000 workers →  #LeadOnLeave ",0,605,2015-09-07 14:48:50,"Dad, husband, President, citizen."
"""Plain and simple, a shutdown would hurt working Americans."" —President Obama ",1738,659,2015-09-05 16:58:31,"Dad, husband, President, citizen."
"In the weekly address, President Obama discusses the need for Congress to pass a budget and avoid a shutdown. ",1501,496,2015-09-05 15:43:46,"Dad, husband, President, citizen."
It's a beautiful world. Let's fight to protect it. ,13194,5541,2015-09-04 21:03:23,"Dad, husband, President, citizen."
Go behind the lens with @PeteSouza's photo gallery from President Obama's recent trip to Alaska. ,1378,476,2015-09-04 20:03:02,"Dad, husband, President, citizen."
DEADLINE: Today is your last chance to show your support for updated overtime rules.  #FixOvertime,803,312,2015-09-04 18:00:04,"Dad, husband, President, citizen."
"Higher wages, 173,000 jobs added, and a dropping unemployment rate are all good news—but there's more work to do. ",1492,586,2015-09-04 17:00:10,"Dad, husband, President, citizen."
RT @WhiteHouse: Good news: The unemployment rate fell to the lowest level since April 2008 last month →  ,0,808,2015-09-04 15:51:54,"Dad, husband, President, citizen."
"The economy added 173,000 jobs in August—a record-breaking 66 consecutive months of private-sector job growth.",2534,1202,2015-09-04 14:24:26,"Dad, husband, President, citizen."
"Under the #IranDeal, Iran can't build a secret nuclear weapon. Learn more: ",1674,999,2015-09-03 21:41:38,"Dad, husband, President, citizen."
RT @CNNPolitics: .@POTUS busts a move with Alaskan middle schoolers   #ObamaAK #Alaska via @KristenhCNN ,0,2185,2015-09-03 19:46:55,"Dad, husband, President, citizen."
Tomorrow is the last day—add your name if you agree it's time to #FixOvertime for millions of middle-class families: ,1161,479,2015-09-03 17:42:56,"Dad, husband, President, citizen."
Read why it's crucial to #FixOvertime protections for millions of working families. ,890,359,2015-09-03 15:36:48,"Dad, husband, President, citizen."
Read how the Obama administration is fighting to restore workers' rights for millions of hard-working Americans. ,1137,428,2015-09-02 21:13:52,"Dad, husband, President, citizen."
"RT @WhiteHouse: Watch @POTUS go behind the camera in Alaska to talk about the impacts of climate change: 
",0,2394,2015-09-02 18:57:04,"Dad, husband, President, citizen."
President Obama is highlighting the effects of climate climate during his trip to Alaska. Check it out: ,1580,707,2015-09-02 17:36:41,"Dad, husband, President, citizen."
"""Few things can have as negative an impact on our economy as climate change."" —President Obama #ActOnClimate ",1747,1020,2015-09-02 15:42:55,"Dad, husband, President, citizen."
"“Climate change is no longer some far-off problem; it is happening here, it is happening now."" —President Obama ",2071,1466,2015-09-01 19:52:41,"Dad, husband, President, citizen."
Get a behind-the-scenes look at President Obama's trip to Alaska—the front lines in the fight against climate change. ,2612,1108,2015-09-01 16:32:38,"Dad, husband, President, citizen."
Make your voice heard on updating overtime rules before Friday's deadline:  #FixOvertime ,1317,523,2015-09-01 15:18:07,"Dad, husband, President, citizen."
It's official: Mount McKinley is now Denali.  ,5780,2407,2015-08-31 21:21:27,"Dad, husband, President, citizen."
Read what former U.S. Secretary of State @Madeleine Albright has to say about the #IranDeal. ,936,500,2015-08-31 19:37:19,"Dad, husband, President, citizen."
RT @WhiteHouse: Follow along as @POTUS heads to the frontlines of our fight against climate change in Alaska →  ,0,715,2015-08-31 18:01:37,"Dad, husband, President, citizen."
Find out how @OFA is giving organizers around the country the training and management skills they need to succeed. ,784,268,2015-08-31 16:27:14,"Dad, husband, President, citizen."
"""As long as I’m President, America will lead the world to meet the threat of climate change."" —President Obama ",4855,1943,2015-08-29 16:34:48,"Dad, husband, President, citizen."
"In the weekly address, President Obama discusses his upcoming trip to Alaska and pledges to #ActOnClimate. ",1374,447,2015-08-29 15:12:00,"Dad, husband, President, citizen."
Read @AmbassadorPower's thoughts on why it's vital for Congress to stand by the #IranDeal. ,869,367,2015-08-28 20:55:40,"Dad, husband, President, citizen."
These professional fellows learned skills that will help them keep fighting for the issues that matter. ,965,343,2015-08-28 18:59:02,"Dad, husband, President, citizen."
"Add your name—because in 2015, equal pay for equal work shouldn't be controversial.  #StandWithWomen",1921,1000,2015-08-28 16:46:09,"Dad, husband, President, citizen."
"RT @WhiteHouse: ""You know the sun comes out after every storm."" —@POTUS on the progress since Katrina and the work still ahead: ",0,639,2015-08-28 15:36:12,"Dad, husband, President, citizen."
LIVE: President Obama is speaking about the rebuilding of New Orleans ten years after Hurricane Katrina.  #Katrina10,1047,479,2015-08-27 21:02:00,"Dad, husband, President, citizen."
Tune in at 4:55 p.m. ET to watch President Obama discuss #Katrina10 and the rebirth of New Orleans. ,739,305,2015-08-27 19:58:45,"Dad, husband, President, citizen."
"Add your name if you believe that when women succeed, America succeeds:  #StandWithWomen",1925,883,2015-08-27 18:11:36,"Dad, husband, President, citizen."
RT @WhiteHouse: Secretary @ErnestMoniz spent 40 years on the nuclear physics faculty at MIT. Watch him explain the #IranDeal science: ,0,666,2015-08-27 17:07:20,"Dad, husband, President, citizen."
Meet Alexa—an @OFA supporter who knows there's no better time to fight for progress than now. ,685,219,2015-08-27 16:10:19,"Dad, husband, President, citizen."
One organizer is sharing her story about continuing the fight for women’s rights: ,1021,416,2015-08-27 14:52:23,"Dad, husband, President, citizen."
"This #WomensEqualityDay, say you'll continue the fight for progress.  ",4651,2936,2015-08-26 22:13:43,"Dad, husband, President, citizen."
The fight for equality is not over. #WomensEqualityDay ,3941,2769,2015-08-26 20:35:05,"Dad, husband, President, citizen."
"""No challenge poses a greater threat to our future than climate change."" —President Obama  #ActOnClimate",1720,987,2015-08-25 22:23:10,"Dad, husband, President, citizen."
