"Despite Judge Garland's qualifications, some Senate leaders still refuse to give him a hearing—speak out: ",1608,553,2016-05-20 15:46:02,"Dad, husband, President, citizen."
The uninsured rate just hit 9.1 percent—the lowest ever recorded. ,2469,824,2016-05-19 21:11:05,"Dad, husband, President, citizen."
Don't miss this:  ,2221,473,2016-05-19 19:37:34,"Dad, husband, President, citizen."
"Thanks to the new #overtime rule, millions of hard-working Americans will have more economic security. ",7155,1971,2016-05-19 17:21:02,"Dad, husband, President, citizen."
Stand up for middle-class workers—add your name to support the Obama administration's new #overtime rule: ,1574,409,2016-05-19 16:02:46,"Dad, husband, President, citizen."
Marriage equality? Affordable health care? Or economic progress? Tell him in person:  ,2365,479,2016-05-18 22:03:43,"Dad, husband, President, citizen."
RT @WhiteHouse: Today we're updating and strengthening #overtime pay rules to make sure millions more Americans are paid fairly. ,0,864,2016-05-18 21:18:38,"Dad, husband, President, citizen."
Add your name if you support the Obama administration's new #overtime rule that expands protections for millions: ,1584,435,2016-05-18 20:22:52,"Dad, husband, President, citizen."
LIVE: @VP Biden is speaking about the economy at @jenisicecreams headquarters in Ohio. ,892,213,2016-05-18 18:53:14,"Dad, husband, President, citizen."
This is a big day for millions of middle-class workers. ,3743,1054,2016-05-18 18:01:01,"Dad, husband, President, citizen."
LIVE: Senate Judiciary Democrats are holding a forum on Judge Merrick Garland. ,1513,403,2016-05-18 15:35:55,"Dad, husband, President, citizen."
RT @WhiteHouse: BREAKING: @POTUS is taking an important step on #overtime to ensure your work is rewarded →  ,0,724,2016-05-18 00:35:21,"Dad, husband, President, citizen."
Here's your chance: Tell President Obama what you're most thankful for—in person.  ,3060,624,2016-05-17 21:58:52,"Dad, husband, President, citizen."
"Judge Garland's former clerks have a lot to say about his record, work-life balance, and more—take a look: ",2065,529,2016-05-17 19:04:28,"Dad, husband, President, citizen."
Senate leaders are continuing to obstruct a fair hearing for Judge Garland—help put the pressure on:  #DoYourJob,1471,474,2016-05-17 17:15:15,"Dad, husband, President, citizen."
It's time for Senate leaders to put politics aside and fill the Supreme Court vacancy. #DoYourJob ,8295,2565,2016-05-17 15:11:18,"Dad, husband, President, citizen."
April was the seventh consecutive month of record-high temperatures. We need to #ActOnClimate. ,3387,1773,2016-05-16 21:48:44,"Dad, husband, President, citizen."
Think Senate leaders should do their jobs and give Judge Garland a fair hearing? Add your name:  #DoYourJob,1528,443,2016-05-16 20:53:23,"Dad, husband, President, citizen."
"LIVE: President Obama is speaking with @BuzzFeed about his #SCOTUS nominee, Judge Merrick Garland. ",1283,317,2016-05-16 18:58:11,"Dad, husband, President, citizen."
RT @BuzzFeed: Tune in this afternoon as @chrisgeidner interviews President Obama live from the White House on FB Live and YouTube! ,0,343,2016-05-16 17:38:10,"Dad, husband, President, citizen."
We need to lead this fight. #ActOnClimate ,1948,572,2016-05-16 16:06:47,"Dad, husband, President, citizen."
Change happens because people like you fight to make it happen. ,7729,2971,2016-05-13 22:01:09,"Dad, husband, President, citizen."
Show your support for continued efforts to tackle climate change:  #ActOnClimate,1359,388,2016-05-13 21:01:46,"Dad, husband, President, citizen."
Read more about the historic new standards in place to reduce methane pollution: ,1362,398,2016-05-13 19:53:15,"Dad, husband, President, citizen."
Senate leaders should listen to the American people. #DoYourJob ,5622,2116,2016-05-13 18:33:29,"Dad, husband, President, citizen."
Say you support a fair #SCOTUS nomination process—speak up now: ,1424,380,2016-05-13 17:27:43,"Dad, husband, President, citizen."
Find out what Judge Merrick Garland's former clerks have to say about his record as a public servant: ,2107,514,2016-05-13 15:31:25,"Dad, husband, President, citizen."
Editorial boards are speaking up on the #SCOTUS vacancy. Here's what they're saying:  #DoYourJob,1448,420,2016-05-12 21:28:58,"Dad, husband, President, citizen."
Add your name if you support big steps forward in the fight to tackle climate change:  #ActOnClimate,1394,398,2016-05-12 19:16:26,"Dad, husband, President, citizen."
The Obama administration just finalized standards to cut methane pollution and improve public health. #ActOnClimate ,6743,1792,2016-05-12 17:37:57,"Dad, husband, President, citizen."
We can't afford to have a key part of our democracy understaffed. We need nine justices. #DoYourJob ,10008,3259,2016-05-12 15:33:01,"Dad, husband, President, citizen."
The Senate should give President Obama's Supreme Court nominee a fair hearing and an up-or-down vote. #DoYourJob ,5461,2172,2016-05-11 22:35:32,"Dad, husband, President, citizen."
Add your voice to the push for a fair Supreme Court nomination process:  #DoYourJob ,1756,475,2016-05-11 19:26:43,"Dad, husband, President, citizen."
Here's where editorial boards across the country stand when it comes to the #SCOTUS vacancy:  #DoYourJob,1615,429,2016-05-11 16:17:20,"Dad, husband, President, citizen."
Senate leaders: #DoYourJob and give Judge Garland the fair hearing he deserves. ,5512,1579,2016-05-10 20:59:33,"Dad, husband, President, citizen."
"RT @SCOTUSnom: Like the #SCOTUS nominees before him, Judge Garland filled out a questionnaire for Senators:  ",0,209,2016-05-10 20:07:56,"Dad, husband, President, citizen."
Join the hundreds of thousands of people calling on Senate leaders to give Judge Garland a fair hearing: ,1738,555,2016-05-10 18:55:32,"Dad, husband, President, citizen."
Judge Garland has impeccable credentials—he deserves a fair hearing from the Senate. #DoYourJob ,8308,2918,2016-05-10 16:16:51,"Dad, husband, President, citizen."
Add your name if you agree: We need a full Supreme Court bench for a functioning democracy.  #DoYourJob,2265,724,2016-05-09 19:39:57,"Dad, husband, President, citizen."
Partisan obstructionism shouldn't hold back our Supreme Court. #DoYourJob ,3927,1172,2016-05-09 17:24:54,"Dad, husband, President, citizen."
President Obama has a message for @OFA supporters on the work ahead: ,1548,337,2016-05-09 15:13:47,"Dad, husband, President, citizen."
"""This Mother’s Day, say thank you. Say, 'I love you.'"" —President Obama ",6170,1608,2016-05-08 17:26:02,"Dad, husband, President, citizen."
Add your name if you think Senate leaders need to stop obstructing our Supreme Court:  #DoYourJob,2627,732,2016-05-06 21:05:19,"Dad, husband, President, citizen."
"RT @WhiteHouse: “The economy has been growing, unemployment has been falling, and wages have been rising” —@POTUS ",0,712,2016-05-06 18:48:07,"Dad, husband, President, citizen."
74 consecutive months—more than six years—of private-sector job growth. Let's keep up the progress. ,7926,2583,2016-05-06 16:45:28,"Dad, husband, President, citizen."
LIVE: President Obama is speaking about the economy and new steps to strengthen financial transparency. ,1236,340,2016-05-06 16:16:51,"Dad, husband, President, citizen."
"The economy added 160,000 jobs in April—a record-breaking 74 months of private-sector job growth.",4609,1424,2016-05-06 13:39:15,"Dad, husband, President, citizen."
President Obama just granted clemency to 58 men and women who've earned a second chance:  #FixTheSystem,4063,1248,2016-05-05 21:12:07,"Dad, husband, President, citizen."
Say that Senate leaders should stop hiding behind excuses and give Judge Garland a fair hearing:  #DoYourJob,1982,676,2016-05-05 19:13:04,"Dad, husband, President, citizen."
Check out President Obama's latest message to @OFA supporters and volunteers: ,1318,319,2016-05-05 17:12:36,"Dad, husband, President, citizen."
"RT @WhiteHouse: ""A young girl shouldn't have to go to Washington to be heard."" —@POTUS on 8-year-old Mari:  ",0,1810,2016-05-05 16:13:39,"Dad, husband, President, citizen."
"President Obama: When American workers and businesses compete on a level playing field, no one can beat us. ",2796,793,2016-05-04 22:12:41,"Dad, husband, President, citizen."
"LIVE: President Obama is speaking at Northwestern High School in Flint, Michigan. ",1287,386,2016-05-04 20:11:05,"Dad, husband, President, citizen."
Retweet if you agree. #DoYourJob ,5491,4125,2016-05-04 18:00:15,"Dad, husband, President, citizen."
Make your voice heard on a fair #SCOTUS nomination process—add your name today:  #DoYourJob,1464,420,2016-05-04 15:51:01,"Dad, husband, President, citizen."
LIVE: President Obama honors the 2016 National Teacher of the Year. ,1298,372,2016-05-03 20:33:43,"Dad, husband, President, citizen."
Good climate change policy and good economic policy can go hand in hand. #ActOnClimate ,6590,2005,2016-05-03 17:44:41,"Dad, husband, President, citizen."
American workers deserve a trade agreement that works for them. Check out President Obama's op-ed on #TPP: ,2557,643,2016-05-03 16:40:39,"Dad, husband, President, citizen."
The United States just hit one million solar installations—enough to power 5.5 million homes. #MillionSolarStrong,6076,1985,2016-05-03 14:00:16,"Dad, husband, President, citizen."
Say you're one of the majority of Americans who want Senate leaders to give Judge Garland a fair hearing.  #DoYourJob,2345,797,2016-05-02 21:31:18,"Dad, husband, President, citizen."
Building a clean energy economy is a great way to #ActOnClimate for people across the country. ,4629,1235,2016-05-02 20:08:48,"Dad, husband, President, citizen."
Read what editorial boards across the country have to say about the #SCOTUS vacancy: ,1244,402,2016-05-02 18:46:37,"Dad, husband, President, citizen."
It's unacceptable for obstructionists in the Senate to play political games with the Supreme Court. Say you agree: ,2296,809,2016-05-02 15:59:17,"Dad, husband, President, citizen."
"""And with that, I just have two more words to say—Obama out."" —President Obama at the #WHCD

Don't miss this: ",8312,2523,2016-05-01 22:26:34,"Dad, husband, President, citizen."
"Watch ""Couch Commander"" President Obama at last night's #WHCD: ",2642,764,2016-05-01 20:15:17,"Dad, husband, President, citizen."
LIVE: President Obama is speaking at the #WHCD. ,4116,1357,2016-05-01 02:05:12,"Dad, husband, President, citizen."
"Tune in at 8:00 p.m. ET to watch ""Comedian-in-Chief"" President Obama at the #WHCD: ",1997,573,2016-04-30 22:28:06,"Dad, husband, President, citizen."
"""Poll after poll shows a majority of Americans think Senate Republicans should do their job."" —President Obama ",3570,975,2016-04-30 21:18:06,"Dad, husband, President, citizen."
"In the weekly address, President Obama has a simple message for Senate Republicans: #DoYourJob. ",2907,832,2016-04-30 15:36:39,"Dad, husband, President, citizen."
Senate leaders need to do their jobs and fill the #SCOTUS vacancy. #DoYourJob ,6590,3088,2016-04-29 21:06:33,"Dad, husband, President, citizen."
Clean air makes for healthier and safer communities. #ActOnClimate ,3310,892,2016-04-29 15:10:47,"Dad, husband, President, citizen."
Hundreds of thousands of Americans are calling on Senate leaders to fill the #SCOTUS vacancy—join them: ,2006,680,2016-04-28 21:18:23,"Dad, husband, President, citizen."
It's been more than 40 days since Judge Garland was nominated. Senate leaders: #DoYourJob. ,8139,3262,2016-04-28 20:21:27,"Dad, husband, President, citizen."
"Don't let climate change deniers jeopardize the progress we've made toward a safer, healthier future. Call them out: ",2698,1068,2016-04-28 18:08:22,"Dad, husband, President, citizen."
Fighting climate change will save Americans money at the gas pump. #ActOnClimate ,3404,844,2016-04-28 15:30:07,"Dad, husband, President, citizen."
Add your name if you support global efforts to tackle climate change: ,1678,532,2016-04-27 22:20:17,"Dad, husband, President, citizen."
Watch Professor Obama take obstructionists in the Senate back to school with #SCOTUS 101. #DoYourJob ,2800,1115,2016-04-27 21:15:58,"Dad, husband, President, citizen."
"For the health of our children and grandchildren, we have to #ActOnClimate. ",3723,988,2016-04-27 20:09:45,"Dad, husband, President, citizen."
The Senate should uphold its constitutional duty and give Judge Garland a fair hearing. Add your name if you agree: ,2101,719,2016-04-27 18:40:21,"Dad, husband, President, citizen."
Watch: Professor Obama has a #SCOTUS lesson for obstructionists in the Senate. #DoYourJob ,1852,710,2016-04-27 16:44:15,"Dad, husband, President, citizen."
"""Not to let the Constitution function is totally irresponsible and it's never happened like this before."" —@VP ",3630,1924,2016-04-26 20:58:35,"Dad, husband, President, citizen."
Don't let climate change deniers derail progress—show your support for bold action on climate change:  #ActOnClimate,1407,503,2016-04-26 20:02:05,"Dad, husband, President, citizen."
The fight to tackle climate change took a big step on Friday with hundreds of countries signing the #ParisAgreement. ,7677,2629,2016-04-26 18:15:38,"Dad, husband, President, citizen."
ICYMI: The U.S. and more than 170 other nations just signed the #ParisAgreement—the first ever global climate deal. ,2129,731,2016-04-26 16:29:47,"Dad, husband, President, citizen."
We all play a part in helping to stop gun violence. Do your part—#WearOrange on June 2. ,3518,1764,2016-04-25 21:43:29,"Dad, husband, President, citizen."
We're already seeing the effects of climate change. Denial is unacceptable. #ActOnClimate ,6432,2658,2016-04-25 19:22:00,"Dad, husband, President, citizen."
Show your support for bold moves to combat climate change—add your name:  #ActOnClimate,1285,421,2016-04-25 17:28:38,"Dad, husband, President, citizen."
Carbon pollution is the biggest contributor to climate change—and President Obama is taking it head on. ,5506,1727,2016-04-25 15:24:10,"Dad, husband, President, citizen."
"""We have criminal justice policies, including unfair sentencing laws, that need to be reformed."" —President Obama ",3060,983,2016-04-23 19:36:21,"Dad, husband, President, citizen."
"In the weekly address, President Obama talks about his efforts to improve our criminal justice system.  #FixTheSystem",1861,482,2016-04-23 18:07:24,"Dad, husband, President, citizen."
"""From our family to yours, chag sameach."" —President Obama #Passover",3429,850,2016-04-23 15:55:57,"Dad, husband, President, citizen."
Happy #EarthDay. ,5787,2250,2016-04-22 22:35:55,"Dad, husband, President, citizen."
RT @VancityReynolds: Huge day for our Great Green Spinning Chunk of Awesome. Thank you world leaders for taking #ClimateAction. ,0,2064,2016-04-22 22:22:38,"Dad, husband, President, citizen."
We can tackle climate change—but it's going to take all of us working together. #ActOnClimate ,6425,2195,2016-04-22 21:53:41,"Dad, husband, President, citizen."
"RT @Interior: Healthy parks = Healthy planet 🌎
#EarthDay #ActOnClimate ",0,785,2016-04-22 21:18:42,"Dad, husband, President, citizen."
Bold action on climate change matters. #ActOnClimate ,2088,768,2016-04-22 19:34:37,"Dad, husband, President, citizen."
Say you'll stand up for bold action to fight climate change:  #ActOnClimate,1318,451,2016-04-22 18:08:46,"Dad, husband, President, citizen."
"RT @WhiteHouse: “Today, on #EarthDay, our governments, along with about 170 others, are in New York to sign that agreement.” —@POTUS ",0,693,2016-04-22 17:19:25,"Dad, husband, President, citizen."
The Paris Agreement is a big deal. #ActOnClimate ,3005,1143,2016-04-22 16:08:57,"Dad, husband, President, citizen."
RT @OFA: President Obama is protecting our lands and waters for future generations. #NationalParkWeek ,0,516,2016-04-22 15:47:02,"Dad, husband, President, citizen."
"""'A strong spirit transcends rules,' Prince once said—and nobody's spirit was stronger, bolder, or more creative."" —President Obama",33698,16016,2016-04-21 20:07:29,"Dad, husband, President, citizen."
President Obama is investing in a more sustainable future. #ActOnClimate ,3475,908,2016-04-21 16:21:33,"Dad, husband, President, citizen."
RT @WhiteHouse: .@VP breaks down why it's time for the Senate Republicans to give the President's @SCOTUSnom a hearing. #DoYourJob  ,0,908,2016-04-20 21:23:12,"Dad, husband, President, citizen."
We can't let climate change deniers derail progress—say you stand for bold action:  #ActOnClimate,1443,529,2016-04-20 19:37:33,"Dad, husband, President, citizen."
Continuing to invest in clean energy like solar power is critical in the fight to #ActOnClimate. ,5429,1642,2016-04-20 17:26:36,"Dad, husband, President, citizen."
"Last year, wind energy generated enough electricity to power 17.5 million homes:  #ActOnClimate",1723,547,2016-04-20 16:00:40,"Dad, husband, President, citizen."
Add your name to support bold action to combat climate change:  #ActOnClimate,1434,459,2016-04-19 22:08:34,"Dad, husband, President, citizen."
Climate change is real—and it's devastating communities across the country. We have #ActOnClimate now. ,10906,5694,2016-04-19 19:26:03,"Dad, husband, President, citizen."
The wind energy industry keeps growing—here's the latest on its record-setting year:  #ActOnClimate,1670,531,2016-04-19 17:52:06,"Dad, husband, President, citizen."
Stand up today for a fair Supreme Court nomination process:  #DoYourJob,1763,581,2016-04-19 15:43:12,"Dad, husband, President, citizen."
Happy National Park Week. Go #FindYourPark today.  ,3982,1258,2016-04-18 22:23:14,"Dad, husband, President, citizen."
President Obama's #ImmigrationAction could have a big economic impact. ,2901,883,2016-04-18 20:56:54,"Dad, husband, President, citizen."
Last month continued the streak of record-breaking global temperatures.  #ActOnClimate,1897,1253,2016-04-18 19:55:31,"Dad, husband, President, citizen."
This is unprecedented. #DoYourJob ,4351,1781,2016-04-18 17:56:48,"Dad, husband, President, citizen."
Show your support for a fair hearing and timely up-or-down vote for Judge Merrick Garland:  #DoYourJob,2482,794,2016-04-18 15:44:28,"Dad, husband, President, citizen."
Editorial boards are making their voices heard on the #SCOTUS nomination process. See what they're saying: ,2735,733,2016-04-15 20:57:23,"Dad, husband, President, citizen."
Add your name if you think the Senate should give Judge Garland fair consideration:  ,4676,1184,2016-04-15 15:55:09,"Dad, husband, President, citizen."
See what editorial boards are saying about Senate leaders' refusal to give Judge Garland a fair hearing: ,2518,899,2016-04-14 21:53:45,"Dad, husband, President, citizen."
This kind of Senate obstructionism is completely unprecedented. #DoYourJob ,4975,1807,2016-04-14 17:32:40,"Dad, husband, President, citizen."
Climate change means wildfires are now a continual threat in some parts of the country:  #ActOnClimate,1852,620,2016-04-14 16:14:58,"Dad, husband, President, citizen."
RT @WhiteHouse: .@POTUS highlights a few of the young innovators at the #WHScienceFair:  ,0,710,2016-04-13 20:53:59,"Dad, husband, President, citizen."
LIVE: President Obama is delivering remarks at the #WHScienceFair. ,1151,281,2016-04-13 19:05:30,"Dad, husband, President, citizen."
Tune in at 2:50 p.m. ET to watch President Obama speak at the #WHScienceFair: ,921,274,2016-04-13 17:45:13,"Dad, husband, President, citizen."
Judge Garland is highly qualified for the Supreme Court—he deserves a hearing.  #DoYourJob ,4033,1382,2016-04-13 17:19:57,"Dad, husband, President, citizen."
Read why having nine Supreme Court justices is critical for our judicial system:  #DoYourJob,1937,735,2016-04-13 15:46:29,"Dad, husband, President, citizen."
It's time. #EqualPayDay ,6227,2692,2016-04-12 22:13:10,"Dad, husband, President, citizen."
"""Improving gender equality would add at least $2.1 trillion to U.S. gross domestic product by 2025.""  #EqualPayDay",2704,1204,2016-04-12 21:13:04,"Dad, husband, President, citizen."
Retweet if you agree. #EqualPayDay ,8568,8616,2016-04-12 19:25:35,"Dad, husband, President, citizen."
Stand up for equal pay—add your name now:  #EqualPayDay,1515,558,2016-04-12 17:37:31,"Dad, husband, President, citizen."
"""I'm here to say we will close the wage gap."" —President Obama #EqualPayDay ",3904,1322,2016-04-12 16:23:10,"Dad, husband, President, citizen."
LIVE: President Obama is speaking about women's equality on #EqualPayDay. ,1642,570,2016-04-12 15:36:17,"Dad, husband, President, citizen."
Tune in at 11:25 a.m. ET to watch as President Obama designates a new national monument honoring women's equality: ,1821,555,2016-04-12 15:06:47,"Dad, husband, President, citizen."
"RT @WhiteHouse: On #EqualPayDay, @POTUS will designate a new national monument honoring women’s equality:  ",0,856,2016-04-12 14:24:40,"Dad, husband, President, citizen."
Side by side. #NationalPetDay ,17969,4258,2016-04-11 21:50:28,"Dad, husband, President, citizen."
"RT @SCOTUSnom: ICYMI: @POTUS discusses what his hope is in the Senate regarding his nominee, Judge Garland. 

(Hint: #DoYourJob) ",0,400,2016-04-11 21:06:57,"Dad, husband, President, citizen."
We cannot let political gridlock and dysfunction spread to our Supreme Court. ,7439,2546,2016-04-11 19:29:51,"Dad, husband, President, citizen."
It's time for the United States to #LeadOnLeave—show your support if you agree: ,1614,394,2016-04-11 17:11:20,"Dad, husband, President, citizen."
Retweet if you believe it's time for the United States to #LeadOnLeave. ,6350,3391,2016-04-11 15:34:06,"Dad, husband, President, citizen."
Speak up for a fair hearing for Judge Merrick Garland:  #DoYourJob,2421,811,2016-04-08 21:23:02,"Dad, husband, President, citizen."
This is unprecedented. #DoYourJob ,4677,2009,2016-04-08 18:52:17,"Dad, husband, President, citizen."
Add a comment if you agree: American workers shouldn't have to choose between their health and a paycheck. ,3336,760,2016-04-08 17:04:33,"Dad, husband, President, citizen."
Working families in America should have the basic security of paid sick leave. #LeadOnLeave ,7510,1819,2016-04-08 15:45:49,"Dad, husband, President, citizen."
"If you think Judge Merrick Garland deserves a fair hearing and an up-or-down vote, add your name:  #DoYourJob",3211,985,2016-04-07 22:06:06,"Dad, husband, President, citizen."
"RT @SCOTUSnom: ""Why is it so hard for this guy to get a hearing and a vote?"" —@POTUS on GOP obstruction of #SCOTUS nom. #DoYourJob ",0,387,2016-04-07 20:33:37,"Dad, husband, President, citizen."
LIVE: The President is at @UChicagoLaw discussing why Judge Garland deserves a fair hearing and an up-or-down vote. ,1644,396,2016-04-07 19:47:52,"Dad, husband, President, citizen."
Tune in at 3:30 p.m. ET to watch President Obama speak about the #SCOTUS nomination process at @UChicagoLaw: ,926,233,2016-04-07 19:02:19,"Dad, husband, President, citizen."
Read what a former @UChicagoLaw student learned from Professor Obama:  ,3844,958,2016-04-07 18:12:47,"Dad, husband, President, citizen."
Show your support for the proposal to expand paid sick leave—add a comment today:  #LeadOnLeave,1661,401,2016-04-07 17:03:37,"Dad, husband, President, citizen."
The U.S. is the only advanced nation that doesn't guarantee paid sick leave—it's time to change that. #LeadOnLeave ,10969,3457,2016-04-07 15:34:53,"Dad, husband, President, citizen."
The Senate has more than enough time to give Judge Garland a fair up-or-down vote. #DoYourJob ,10171,4254,2016-04-06 22:17:05,"Dad, husband, President, citizen."
RT @SmlBizMajority: Obama’s National Monuments Have Been An Economic Boon For Local Economies  via @climateprogress,0,237,2016-04-06 20:20:33,"Dad, husband, President, citizen."
Add your voice to the thousands calling on Senate leaders to give Judge Merrick Garland a fair hearing:  #DoYourJob,3309,1110,2016-04-06 18:27:30,"Dad, husband, President, citizen."
RT @FactsOnClimate: It's #PublicHealthWeek. Stay informed about how climate change could impact your health →  ,0,289,2016-04-06 16:57:43,"Dad, husband, President, citizen."
"If we don't #ActOnClimate now, the sea level could rise by more than six feet by the end of the century: ",2910,1519,2016-04-06 15:55:12,"Dad, husband, President, citizen."
Clean energy currently employs 2.5 million people in the United States. Check it out:  #ActOnClimate,2855,914,2016-04-05 22:13:43,"Dad, husband, President, citizen."
Ten million workers in California and New York now have better economic security:  #RaiseTheWage,2199,584,2016-04-05 20:09:03,"Dad, husband, President, citizen."
"RT @WhiteHouse: ""We should keep building an economy where everybody has a fair shot, and everybody plays by the same rules."" —@POTUS ",0,803,2016-04-05 18:17:13,"Dad, husband, President, citizen."
LIVE: President Obama is delivering a statement on the economy. ,1239,300,2016-04-05 16:16:01,"Dad, husband, President, citizen."
Tune in at 12:15 p.m. ET to watch President Obama deliver a statement about the economy: ,1214,340,2016-04-05 15:34:51,"Dad, husband, President, citizen."
"""Supreme Court struggles with just eight justices.""  #DoYourJob",2168,705,2016-04-04 21:23:01,"Dad, husband, President, citizen."
An overwhelming majority of Americans want a fair #SCOTUS nomination process—add your name if you're one of them: ,3343,1000,2016-04-04 19:36:54,"Dad, husband, President, citizen."
Judge Merrick Garland received bipartisan support in the past. Today should be no different. #DoYourJob ,8963,3184,2016-04-04 17:38:45,"Dad, husband, President, citizen."
Stay informed and get the facts with the @OFA Truth Team:  ,1490,294,2016-04-04 16:06:39,"Dad, husband, President, citizen."
"Our economy is making real progress, but we have to keep fighting to make sure that it works for everybody. ",7758,2585,2016-04-01 19:16:42,"Dad, husband, President, citizen."
